[
  {
    "id": "color-recipe-001",
    "name": "Editorial Warm \u2014 Monochromatic \u2014 Light",
    "archetype": "editorial-warm",
    "mode": "light",
    "harmony": "monochromatic",
    "intentTags": [
      "editorial",
      "cultural",
      "print-inspired",
      "monochromatic",
      "light"
    ],
    "roles": {
      "background": "#F9F9F8",
      "surface1": "#FEFEFE",
      "surface2": "#EFEDEC",
      "textPrimary": "#1D1B18",
      "textMuted": "#675E56",
      "border": "#D5D1CD",
      "accent": "#AB5F1C",
      "accentSecondary": "#CC905C",
      "accentText": "#FFFFFF"
    },
    "contrast": {
      "textOnBackground": 16.31,
      "textOnSurface1": 17.04,
      "mutedOnBackground": 6.02,
      "accentTextOnAccent": 4.79
    },
    "areaGuidance": {
      "backgroundAndNeutral": "70-90%",
      "surfaceAndSupport": "8-25%",
      "strongAccent": "2-10%"
    },
    "teaching": {
      "why": "Editorial Warm uses a monochromatic relationship while preserving a dominant neutral field. The accent is intentionally much stronger in chroma than the surrounding UI.",
      "useAccentFor": [
        "primary CTA",
        "active navigation",
        "one signature detail"
      ],
      "useSecondaryFor": [
        "illustration support",
        "data highlight",
        "subtle 3D rim/fill accent"
      ],
      "avoid": [
        "using both accent colors at equal area",
        "using accent as body text without contrast test",
        "adding a third unrelated decorative hue"
      ]
    },
    "threeDNotes": "Coordinate environment and material lighting with the same temperature family; keep emissive use scarcer than DOM accent.",
    "sourceConfidence": "SYNTHESIZED"
  },
  {
    "id": "color-recipe-002",
    "name": "Editorial Warm \u2014 Analogous \u2014 Light",
    "archetype": "editorial-warm",
    "mode": "light",
    "harmony": "analogous",
    "intentTags": [
      "editorial",
      "cultural",
      "print-inspired",
      "analogous",
      "light"
    ],
    "roles": {
      "background": "#F9F9F8",
      "surface1": "#FEFEFE",
      "surface2": "#EFEDEC",
      "textPrimary": "#1D1B18",
      "textMuted": "#675E56",
      "border": "#D5D1CD",
      "accent": "#AB5F1C",
      "accentSecondary": "#BDC22E",
      "accentText": "#FFFFFF"
    },
    "contrast": {
      "textOnBackground": 16.31,
      "textOnSurface1": 17.04,
      "mutedOnBackground": 6.02,
      "accentTextOnAccent": 4.79
    },
    "areaGuidance": {
      "backgroundAndNeutral": "70-90%",
      "surfaceAndSupport": "8-25%",
      "strongAccent": "2-10%"
    },
    "teaching": {
      "why": "Editorial Warm uses a analogous relationship while preserving a dominant neutral field. The accent is intentionally much stronger in chroma than the surrounding UI.",
      "useAccentFor": [
        "primary CTA",
        "active navigation",
        "one signature detail"
      ],
      "useSecondaryFor": [
        "illustration support",
        "data highlight",
        "subtle 3D rim/fill accent"
      ],
      "avoid": [
        "using both accent colors at equal area",
        "using accent as body text without contrast test",
        "adding a third unrelated decorative hue"
      ]
    },
    "threeDNotes": "Coordinate environment and material lighting with the same temperature family; keep emissive use scarcer than DOM accent.",
    "sourceConfidence": "SYNTHESIZED"
  },
  {
    "id": "color-recipe-003",
    "name": "Editorial Warm \u2014 Complementary \u2014 Light",
    "archetype": "editorial-warm",
    "mode": "light",
    "harmony": "complementary",
    "intentTags": [
      "editorial",
      "cultural",
      "print-inspired",
      "complementary",
      "light"
    ],
    "roles": {
      "background": "#F9F9F8",
      "surface1": "#FEFEFE",
      "surface2": "#EFEDEC",
      "textPrimary": "#1D1B18",
      "textMuted": "#675E56",
      "border": "#D5D1CD",
      "accent": "#AB5F1C",
      "accentSecondary": "#2E7DC2",
      "accentText": "#FFFFFF"
    },
    "contrast": {
      "textOnBackground": 16.31,
      "textOnSurface1": 17.04,
      "mutedOnBackground": 6.02,
      "accentTextOnAccent": 4.79
    },
    "areaGuidance": {
      "backgroundAndNeutral": "70-90%",
      "surfaceAndSupport": "8-25%",
      "strongAccent": "2-10%"
    },
    "teaching": {
      "why": "Editorial Warm uses a complementary relationship while preserving a dominant neutral field. The accent is intentionally much stronger in chroma than the surrounding UI.",
      "useAccentFor": [
        "primary CTA",
        "active navigation",
        "one signature detail"
      ],
      "useSecondaryFor": [
        "illustration support",
        "data highlight",
        "subtle 3D rim/fill accent"
      ],
      "avoid": [
        "using both accent colors at equal area",
        "using accent as body text without contrast test",
        "adding a third unrelated decorative hue"
      ]
    },
    "threeDNotes": "Coordinate environment and material lighting with the same temperature family; keep emissive use scarcer than DOM accent.",
    "sourceConfidence": "SYNTHESIZED"
  },
  {
    "id": "color-recipe-004",
    "name": "Editorial Warm \u2014 Monochromatic \u2014 Dark",
    "archetype": "editorial-warm",
    "mode": "dark",
    "harmony": "monochromatic",
    "intentTags": [
      "editorial",
      "cultural",
      "print-inspired",
      "monochromatic",
      "dark"
    ],
    "roles": {
      "background": "#12100F",
      "surface1": "#1E1B18",
      "surface2": "#2A2622",
      "textPrimary": "#F4F3F3",
      "textMuted": "#BBB5AF",
      "border": "#413A35",
      "accent": "#E09A5C",
      "accentSecondary": "#D9AD87",
      "accentText": "#0B0B0B"
    },
    "contrast": {
      "textOnBackground": 17.13,
      "textOnSurface1": 15.48,
      "mutedOnBackground": 9.34,
      "accentTextOnAccent": 8.39
    },
    "areaGuidance": {
      "backgroundAndNeutral": "70-90%",
      "surfaceAndSupport": "8-25%",
      "strongAccent": "2-10%"
    },
    "teaching": {
      "why": "Editorial Warm uses a monochromatic relationship while preserving a dominant neutral field. The accent is intentionally much stronger in chroma than the surrounding UI.",
      "useAccentFor": [
        "primary CTA",
        "active navigation",
        "one signature detail"
      ],
      "useSecondaryFor": [
        "illustration support",
        "data highlight",
        "subtle 3D rim/fill accent"
      ],
      "avoid": [
        "using both accent colors at equal area",
        "using accent as body text without contrast test",
        "adding a third unrelated decorative hue"
      ]
    },
    "threeDNotes": "Coordinate environment and material lighting with the same temperature family; keep emissive use scarcer than DOM accent.",
    "sourceConfidence": "SYNTHESIZED"
  },
  {
    "id": "color-recipe-005",
    "name": "Editorial Warm \u2014 Analogous \u2014 Dark",
    "archetype": "editorial-warm",
    "mode": "dark",
    "harmony": "analogous",
    "intentTags": [
      "editorial",
      "cultural",
      "print-inspired",
      "analogous",
      "dark"
    ],
    "roles": {
      "background": "#12100F",
      "surface1": "#1E1B18",
      "surface2": "#2A2622",
      "textPrimary": "#F4F3F3",
      "textMuted": "#BBB5AF",
      "border": "#413A35",
      "accent": "#E09A5C",
      "accentSecondary": "#DBDE82",
      "accentText": "#0B0B0B"
    },
    "contrast": {
      "textOnBackground": 17.13,
      "textOnSurface1": 15.48,
      "mutedOnBackground": 9.34,
      "accentTextOnAccent": 8.39
    },
    "areaGuidance": {
      "backgroundAndNeutral": "70-90%",
      "surfaceAndSupport": "8-25%",
      "strongAccent": "2-10%"
    },
    "teaching": {
      "why": "Editorial Warm uses a analogous relationship while preserving a dominant neutral field. The accent is intentionally much stronger in chroma than the surrounding UI.",
      "useAccentFor": [
        "primary CTA",
        "active navigation",
        "one signature detail"
      ],
      "useSecondaryFor": [
        "illustration support",
        "data highlight",
        "subtle 3D rim/fill accent"
      ],
      "avoid": [
        "using both accent colors at equal area",
        "using accent as body text without contrast test",
        "adding a third unrelated decorative hue"
      ]
    },
    "threeDNotes": "Coordinate environment and material lighting with the same temperature family; keep emissive use scarcer than DOM accent.",
    "sourceConfidence": "SYNTHESIZED"
  },
  {
    "id": "color-recipe-006",
    "name": "Editorial Warm \u2014 Complementary \u2014 Dark",
    "archetype": "editorial-warm",
    "mode": "dark",
    "harmony": "complementary",
    "intentTags": [
      "editorial",
      "cultural",
      "print-inspired",
      "complementary",
      "dark"
    ],
    "roles": {
      "background": "#12100F",
      "surface1": "#1E1B18",
      "surface2": "#2A2622",
      "textPrimary": "#F4F3F3",
      "textMuted": "#BBB5AF",
      "border": "#413A35",
      "accent": "#E09A5C",
      "accentSecondary": "#6EA7D8",
      "accentText": "#0B0B0B"
    },
    "contrast": {
      "textOnBackground": 17.13,
      "textOnSurface1": 15.48,
      "mutedOnBackground": 9.34,
      "accentTextOnAccent": 8.39
    },
    "areaGuidance": {
      "backgroundAndNeutral": "70-90%",
      "surfaceAndSupport": "8-25%",
      "strongAccent": "2-10%"
    },
    "teaching": {
      "why": "Editorial Warm uses a complementary relationship while preserving a dominant neutral field. The accent is intentionally much stronger in chroma than the surrounding UI.",
      "useAccentFor": [
        "primary CTA",
        "active navigation",
        "one signature detail"
      ],
      "useSecondaryFor": [
        "illustration support",
        "data highlight",
        "subtle 3D rim/fill accent"
      ],
      "avoid": [
        "using both accent colors at equal area",